{
  "id": "classes/sorceress",
  "name": "Sorceress",
  "startingStats": { "strength": 10, "dexterity": 25, "vitality": 10, "energy": 35 },
  "statGrowth": { "strength": 0.75, "dexterity": 1.5, "vitality": 1, "energy": 3 },
  "lifePerLevel": 6,
  "manaPerLevel": 6,
  "starterSkills": ["sorceress.frost_nova", "sorceress.ice_bolt"]
}
